URL,Version,Status,OIDs,Name,Title,Description,Used
http://hl7.org/fhir/request-intent,4.0.1,draft,"2.16.840.1.113883.4.642.4.114",RequestIntent,RequestIntent,"Codes indicating the degree of authority/intentionality associated with a request.","ValueSet/request-intent"
http://hl7.org/fhir/request-priority,4.0.1,draft,"2.16.840.1.113883.4.642.4.116",RequestPriority,RequestPriority,"Identifies the level of importance to be assigned to actioning the request.","ValueSet/request-priority"
http://hl7.org/fhir/request-status,4.0.1,draft,"2.16.840.1.113883.4.642.4.112",RequestStatus,RequestStatus,"Codes identifying the lifecycle stage of a request.","ValueSet/request-status"
http://snomed.info/sct,null,active,"2.16.840.1.113883.6.96",SNOMED_CT,SNOMED CT (all versions),"SNOMED CT is the most comprehensive and precise clinical health terminology product in the world, owned and distributed around the world by The International Health Terminology Standards Development Organisation (IHTSDO).","ValueSet/VSA,ValueSet/VS1,ValueSet/servicerequest-category,ValueSet/VSB,ValueSet/participant-role,ValueSet/body-site,ValueSet/servicerequest-orderdetail,ValueSet/procedure-reason,ValueSet/medication-as-needed-reason"
http://terminology.hl7.org/CodeSystem/v3-RoleCode,3.0.0,active,"2.16.840.1.113883.5.111",RoleCode,RoleCode,"A set of codes further specifying the kind of Role; specific classification codes for further qualifying RoleClass codes.","ValueSet/v3-ServiceDeliveryLocationRoleType"
urn:ietf:bcp:47,2.0.1,active,"2.16.840.1.113883.6.121",Ietf3066,Tags for the Identification of Languages,"Older value from OID registry.  Superceded; see recommendations in BCP-47.","ValueSet/languages"
